{
  "$schema": "https://json-schema.org/draft/2020-12/schema",
  "$id": "https://otakudataviz.com/schemas/reference-page.schema.json",
  "title": "Otaku Data Viz Reference Page",
  "type": "object",
  "additionalProperties": false,
  "required": [
    "schemaVersion",
    "id",
    "slug",
    "projectId",
    "dataset",
    "title",
    "description",
    "cardTitle",
    "cardDescription",
    "sitemapPriority",
    "eyebrow",
    "heading",
    "introduction",
    "answer",
    "facts",
    "table",
    "sections",
    "methodology",
    "limitations",
    "faq"
  ],
  "properties": {
    "schemaVersion": { "const": "1.0.0" },
    "id": { "type": "string", "pattern": "^[a-z0-9]+(?:-[a-z0-9]+)*$" },
    "slug": { "type": "string", "pattern": "^[a-z0-9]+(?:-[a-z0-9]+)*$" },
    "projectId": { "type": "string", "pattern": "^[a-z0-9]+(?:-[a-z0-9]+)*$" },
    "dataset": {
      "type": "object",
      "additionalProperties": false,
      "required": ["id", "version", "manifestPath", "publicPath"],
      "properties": {
        "id": { "type": "string", "minLength": 1 },
        "version": { "type": "string", "minLength": 1 },
        "manifestPath": { "type": "string", "pattern": "^/datasets/" },
        "publicPath": { "type": "string", "pattern": "^/assets/data/" }
      }
    },
    "title": { "type": "string", "minLength": 1 },
    "description": { "type": "string", "minLength": 1 },
    "cardTitle": { "type": "string", "minLength": 1 },
    "cardDescription": { "type": "string", "minLength": 1 },
    "sitemapPriority": { "type": "number", "minimum": 0, "maximum": 1 },
    "eyebrow": { "type": "string", "minLength": 1 },
    "heading": { "type": "string", "minLength": 1 },
    "introduction": { "type": "string", "minLength": 1 },
    "answer": {
      "type": "object",
      "additionalProperties": false,
      "required": ["heading", "body"],
      "properties": {
        "heading": { "type": "string", "minLength": 1 },
        "body": { "type": "string", "minLength": 1 }
      }
    },
    "visualizationViews": {
      "type": "array",
      "minItems": 1,
      "items": {
        "type": "object",
        "additionalProperties": false,
        "required": ["label", "description", "href"],
        "properties": {
          "label": { "type": "string", "minLength": 1 },
          "description": { "type": "string", "minLength": 1 },
          "href": { "type": "string", "pattern": "^/" }
        }
      }
    },
    "facts": {
      "type": "array",
      "minItems": 3,
      "items": {
        "type": "object",
        "additionalProperties": false,
        "required": ["label", "value", "detail"],
        "properties": {
          "label": { "type": "string", "minLength": 1 },
          "value": { "type": "string", "minLength": 1 },
          "detail": { "type": "string", "minLength": 1 }
        }
      }
    },
    "table": {
      "type": "object",
      "additionalProperties": false,
      "required": ["caption", "columns", "rows"],
      "properties": {
        "caption": { "type": "string", "minLength": 1 },
        "columns": {
          "type": "array",
          "minItems": 2,
          "items": { "type": "string", "minLength": 1 }
        },
        "rows": {
          "type": "array",
          "minItems": 1,
          "items": {
            "type": "array",
            "minItems": 2,
            "items": { "type": "string" }
          }
        }
      }
    },
    "sections": {
      "type": "array",
      "minItems": 2,
      "items": {
        "type": "object",
        "additionalProperties": false,
        "required": ["id", "heading", "paragraphs"],
        "properties": {
          "id": { "type": "string", "pattern": "^[a-z0-9]+(?:-[a-z0-9]+)*$" },
          "heading": { "type": "string", "minLength": 1 },
          "paragraphs": {
            "type": "array",
            "minItems": 1,
            "items": { "type": "string", "minLength": 1 }
          }
        }
      }
    },
    "methodology": {
      "type": "object",
      "additionalProperties": false,
      "required": ["lastReviewed", "summary", "sources"],
      "properties": {
        "lastReviewed": { "type": "string", "format": "date" },
        "summary": { "type": "string", "minLength": 1 },
        "sources": {
          "type": "array",
          "minItems": 1,
          "items": {
            "type": "object",
            "additionalProperties": false,
            "required": ["name", "url", "role"],
            "properties": {
              "name": { "type": "string", "minLength": 1 },
              "url": { "type": "string", "format": "uri" },
              "role": { "type": "string", "minLength": 1 }
            }
          }
        }
      }
    },
    "limitations": {
      "type": "array",
      "minItems": 1,
      "items": { "type": "string", "minLength": 1 }
    },
    "faq": {
      "type": "array",
      "minItems": 2,
      "items": {
        "type": "object",
        "additionalProperties": false,
        "required": ["question", "answer"],
        "properties": {
          "question": { "type": "string", "minLength": 1 },
          "answer": { "type": "string", "minLength": 1 }
        }
      }
    }
  }
}
